{
  "$schema": "https://json-schema.org/draft/2020-12/schema",
  "type": "object",
  "properties": {
    "start": {
      "minItems": 1,
      "type": "array",
      "items": {
        "type": "string",
        "pattern": "^[a-z0-9]+(?:-[a-z0-9]+)*$"
      }
    },
    "unlocks": {
      "type": "object",
      "propertyNames": {
        "type": "string",
        "pattern": "^[a-z0-9]+(?:-[a-z0-9]+)*$"
      },
      "additionalProperties": {
        "$ref": "#/$defs/__schema0"
      }
    },
    "keywords": {
      "type": "array",
      "items": {
        "type": "object",
        "properties": {
          "id": {
            "type": "string",
            "pattern": "^[a-z0-9]+(?:-[a-z0-9]+)*$"
          },
          "label": {
            "type": "string",
            "pattern": "\\S"
          },
          "kind": {
            "type": "string",
            "enum": [
              "person",
              "place",
              "organization",
              "event",
              "object",
              "other"
            ]
          },
          "terms": {
            "minItems": 1,
            "type": "array",
            "items": {
              "type": "string",
              "pattern": "\\S"
            }
          },
          "autolink": {
            "type": "boolean"
          },
          "hiddenTerm": {
            "type": "boolean"
          },
          "results": {
            "minItems": 1,
            "type": "array",
            "items": {
              "type": "object",
              "properties": {
                "documents": {
                  "minItems": 1,
                  "type": "array",
                  "items": {
                    "type": "string",
                    "pattern": "^[a-z0-9]+(?:-[a-z0-9]+)*$"
                  }
                },
                "requires": {
                  "$ref": "#/$defs/__schema0"
                }
              },
              "required": [
                "documents"
              ],
              "additionalProperties": false
            }
          }
        },
        "required": [
          "id",
          "label",
          "kind",
          "terms",
          "results"
        ],
        "additionalProperties": false
      }
    },
    "places": {
      "type": "array",
      "items": {
        "type": "object",
        "properties": {
          "place": {
            "type": "string",
            "pattern": "^[a-z0-9]+(?:-[a-z0-9]+)*$"
          },
          "revealedBy": {
            "$ref": "#/$defs/__schema0"
          },
          "documents": {
            "type": "array",
            "items": {
              "type": "object",
              "properties": {
                "id": {
                  "type": "string",
                  "pattern": "^[a-z0-9]+(?:-[a-z0-9]+)*$"
                },
                "requires": {
                  "$ref": "#/$defs/__schema0"
                }
              },
              "required": [
                "id"
              ],
              "additionalProperties": false
            }
          }
        },
        "required": [
          "place",
          "documents"
        ],
        "additionalProperties": false
      }
    },
    "occupationsUnlock": {
      "type": "object",
      "propertyNames": {
        "type": "string",
        "pattern": "^[a-z0-9]+(?:-[a-z0-9]+)*$"
      },
      "additionalProperties": {
        "$ref": "#/$defs/__schema0"
      }
    },
    "secrets": {
      "type": "array",
      "items": {
        "type": "object",
        "properties": {
          "id": {
            "type": "string",
            "pattern": "^[a-z0-9]+(?:-[a-z0-9]+)*$"
          },
          "title": {
            "type": "string",
            "pattern": "\\S"
          },
          "discoveredBy": {
            "$ref": "#/$defs/__schema0"
          }
        },
        "required": [
          "id",
          "title",
          "discoveredBy"
        ],
        "additionalProperties": false
      }
    },
    "endings": {
      "minItems": 1,
      "type": "array",
      "items": {
        "type": "object",
        "properties": {
          "id": {
            "type": "string",
            "pattern": "^[a-z0-9]+(?:-[a-z0-9]+)*$"
          },
          "file": {
            "type": "string",
            "pattern": "^endings\\/[a-z0-9]+(?:-[a-z0-9]+)*\\.md$"
          },
          "when": {
            "$ref": "#/$defs/__schema1"
          },
          "priority": {
            "type": "integer",
            "minimum": -9007199254740991,
            "maximum": 9007199254740991
          },
          "sections": {
            "type": "object",
            "propertyNames": {
              "type": "string",
              "minLength": 1,
              "maxLength": 40
            },
            "additionalProperties": {
              "$ref": "#/$defs/__schema1"
            }
          }
        },
        "required": [
          "id",
          "file",
          "when",
          "priority"
        ],
        "additionalProperties": false
      }
    },
    "report": {
      "type": "array",
      "items": {
        "type": "object",
        "properties": {
          "id": {
            "type": "string",
            "pattern": "^[a-z0-9]+(?:-[a-z0-9]+)*$"
          },
          "prompt": {
            "type": "string",
            "pattern": "\\S"
          },
          "kind": {
            "type": "string",
            "enum": [
              "question",
              "choice"
            ]
          },
          "askedWhen": {
            "$ref": "#/$defs/__schema1"
          },
          "options": {
            "minItems": 2,
            "type": "array",
            "items": {
              "type": "object",
              "properties": {
                "id": {
                  "type": "string",
                  "pattern": "^[a-z0-9]+(?:-[a-z0-9]+)*$"
                },
                "label": {
                  "type": "string",
                  "pattern": "\\S"
                },
                "availableWhen": {
                  "$ref": "#/$defs/__schema0"
                },
                "unavailableReason": {
                  "type": "string",
                  "maxLength": 140,
                  "pattern": "\\S"
                }
              },
              "required": [
                "id",
                "label"
              ],
              "additionalProperties": false
            }
          }
        },
        "required": [
          "id",
          "prompt",
          "kind",
          "options"
        ],
        "additionalProperties": false
      }
    },
    "demo": {
      "type": "object",
      "properties": {
        "documents": {
          "minItems": 1,
          "type": "array",
          "items": {
            "type": "string",
            "pattern": "^[a-z0-9]+(?:-[a-z0-9]+)*$"
          }
        },
        "slots": {
          "type": "array",
          "items": {
            "type": "string",
            "pattern": "^[a-z0-9]+(?:-[a-z0-9]+)*$"
          }
        },
        "end": {
          "type": "string",
          "pattern": "^[a-z0-9]+(?:-[a-z0-9]+)*$"
        }
      },
      "required": [
        "documents",
        "slots",
        "end"
      ],
      "additionalProperties": false
    }
  },
  "required": [
    "start",
    "unlocks",
    "keywords",
    "places",
    "secrets",
    "endings"
  ],
  "additionalProperties": false,
  "$defs": {
    "__schema0": {
      "anyOf": [
        {
          "type": "object",
          "properties": {
            "read": {
              "type": "string",
              "pattern": "^[a-z0-9]+(?:-[a-z0-9]+)*$"
            }
          },
          "required": [
            "read"
          ],
          "additionalProperties": false
        },
        {
          "type": "object",
          "properties": {
            "unlocked": {
              "type": "string",
              "pattern": "^[a-z0-9]+(?:-[a-z0-9]+)*$"
            }
          },
          "required": [
            "unlocked"
          ],
          "additionalProperties": false
        },
        {
          "type": "object",
          "properties": {
            "searched": {
              "type": "string",
              "pattern": "^[a-z0-9]+(?:-[a-z0-9]+)*$"
            }
          },
          "required": [
            "searched"
          ],
          "additionalProperties": false
        },
        {
          "type": "object",
          "properties": {
            "visited": {
              "type": "string",
              "pattern": "^[a-z0-9]+(?:-[a-z0-9]+)*$"
            }
          },
          "required": [
            "visited"
          ],
          "additionalProperties": false
        },
        {
          "type": "object",
          "properties": {
            "locked": {
              "type": "string",
              "pattern": "^[a-z0-9]+(?:-[a-z0-9]+)*$"
            }
          },
          "required": [
            "locked"
          ],
          "additionalProperties": false
        },
        {
          "type": "object",
          "properties": {
            "groupLocked": {
              "type": "string",
              "pattern": "^[a-z0-9]+(?:-[a-z0-9]+)*$"
            }
          },
          "required": [
            "groupLocked"
          ],
          "additionalProperties": false
        },
        {
          "type": "object",
          "properties": {
            "secret": {
              "type": "string",
              "pattern": "^[a-z0-9]+(?:-[a-z0-9]+)*$"
            }
          },
          "required": [
            "secret"
          ],
          "additionalProperties": false
        },
        {
          "type": "object",
          "properties": {
            "lockedCount": {
              "type": "object",
              "properties": {
                "gte": {
                  "type": "integer",
                  "minimum": 0,
                  "maximum": 9007199254740991
                }
              },
              "required": [
                "gte"
              ],
              "additionalProperties": false
            }
          },
          "required": [
            "lockedCount"
          ],
          "additionalProperties": false
        },
        {
          "type": "object",
          "properties": {
            "all": {
              "minItems": 1,
              "type": "array",
              "items": {
                "$ref": "#/$defs/__schema0"
              }
            }
          },
          "required": [
            "all"
          ],
          "additionalProperties": false
        },
        {
          "type": "object",
          "properties": {
            "any": {
              "minItems": 1,
              "type": "array",
              "items": {
                "$ref": "#/$defs/__schema0"
              }
            }
          },
          "required": [
            "any"
          ],
          "additionalProperties": false
        }
      ]
    },
    "__schema1": {
      "anyOf": [
        {
          "type": "object",
          "properties": {
            "read": {
              "type": "string",
              "pattern": "^[a-z0-9]+(?:-[a-z0-9]+)*$"
            }
          },
          "required": [
            "read"
          ],
          "additionalProperties": false
        },
        {
          "type": "object",
          "properties": {
            "unlocked": {
              "type": "string",
              "pattern": "^[a-z0-9]+(?:-[a-z0-9]+)*$"
            }
          },
          "required": [
            "unlocked"
          ],
          "additionalProperties": false
        },
        {
          "type": "object",
          "properties": {
            "searched": {
              "type": "string",
              "pattern": "^[a-z0-9]+(?:-[a-z0-9]+)*$"
            }
          },
          "required": [
            "searched"
          ],
          "additionalProperties": false
        },
        {
          "type": "object",
          "properties": {
            "visited": {
              "type": "string",
              "pattern": "^[a-z0-9]+(?:-[a-z0-9]+)*$"
            }
          },
          "required": [
            "visited"
          ],
          "additionalProperties": false
        },
        {
          "type": "object",
          "properties": {
            "locked": {
              "type": "string",
              "pattern": "^[a-z0-9]+(?:-[a-z0-9]+)*$"
            }
          },
          "required": [
            "locked"
          ],
          "additionalProperties": false
        },
        {
          "type": "object",
          "properties": {
            "groupLocked": {
              "type": "string",
              "pattern": "^[a-z0-9]+(?:-[a-z0-9]+)*$"
            }
          },
          "required": [
            "groupLocked"
          ],
          "additionalProperties": false
        },
        {
          "type": "object",
          "properties": {
            "secret": {
              "type": "string",
              "pattern": "^[a-z0-9]+(?:-[a-z0-9]+)*$"
            }
          },
          "required": [
            "secret"
          ],
          "additionalProperties": false
        },
        {
          "type": "object",
          "properties": {
            "lockedCount": {
              "type": "object",
              "properties": {
                "gte": {
                  "type": "integer",
                  "minimum": 0,
                  "maximum": 9007199254740991
                }
              },
              "required": [
                "gte"
              ],
              "additionalProperties": false
            }
          },
          "required": [
            "lockedCount"
          ],
          "additionalProperties": false
        },
        {
          "type": "object",
          "properties": {
            "answered": {
              "type": "object",
              "properties": {
                "question": {
                  "type": "string",
                  "pattern": "^[a-z0-9]+(?:-[a-z0-9]+)*$"
                },
                "option": {
                  "type": "string",
                  "pattern": "^[a-z0-9]+(?:-[a-z0-9]+)*$"
                }
              },
              "required": [
                "question",
                "option"
              ],
              "additionalProperties": false
            }
          },
          "required": [
            "answered"
          ],
          "additionalProperties": false
        },
        {
          "type": "object",
          "properties": {
            "not": {
              "$ref": "#/$defs/__schema1"
            }
          },
          "required": [
            "not"
          ],
          "additionalProperties": false
        },
        {
          "type": "object",
          "properties": {
            "all": {
              "minItems": 1,
              "type": "array",
              "items": {
                "$ref": "#/$defs/__schema1"
              }
            }
          },
          "required": [
            "all"
          ],
          "additionalProperties": false
        },
        {
          "type": "object",
          "properties": {
            "any": {
              "minItems": 1,
              "type": "array",
              "items": {
                "$ref": "#/$defs/__schema1"
              }
            }
          },
          "required": [
            "any"
          ],
          "additionalProperties": false
        }
      ]
    }
  }
}
