{
  "start": ["intro"],
  "unlocks": {
    "photo-couple": {
      "read": "acte-mariage"
    },
    "photo-bac": {
      "read": "carte-postale"
    },
    "lettre-maren": {
      "groupLocked": "aines"
    },
    "photo-fratrie": {
      "lockedCount": {
        "gte": 3
      }
    }
  },
  "keywords": [
    {
      "id": "ancel-morvan",
      "label": "Ancel Morvan",
      "kind": "person",
      "terms": ["Ancel Morvan"],
      "results": [
        {
          "documents": ["lettre-ancel"]
        }
      ]
    },
    {
      "id": "ida-brask",
      "label": "Ida Brask",
      "kind": "person",
      "terms": ["Ida Brask"],
      "results": [
        {
          "documents": ["acte-mariage"]
        }
      ]
    },
    {
      "id": "edda-brask",
      "label": "Edda Brask",
      "kind": "person",
      "terms": ["Edda Brask"],
      "results": [
        {
          "documents": ["lettre-edda"]
        }
      ]
    },
    {
      "id": "val-dormant",
      "label": "Val-Dormant",
      "kind": "place",
      "terms": ["Val-Dormant"],
      "results": [
        {
          "documents": ["carte-postale"]
        }
      ]
    },
    {
      "id": "ecole-du-bac",
      "label": "École du Bac",
      "kind": "organization",
      "terms": ["école du Bac"],
      "results": [
        {
          "documents": ["bulletin-ecole"]
        }
      ]
    },
    {
      "id": "moulin-solvig",
      "label": "Moulin Solvig",
      "kind": "place",
      "terms": ["moulin Solvig"],
      "results": [
        {
          "documents": ["annonce-moulin"]
        }
      ]
    }
  ],
  "places": [
    {
      "place": "val-dormant",
      "documents": [
        {
          "id": "registre-val-dormant"
        }
      ]
    }
  ],
  "secrets": [
    {
      "id": "lettres-edda",
      "title": "La correspondance d'Edda",
      "discoveredBy": {
        "read": "lettre-edda"
      }
    }
  ],
  "endings": [
    {
      "id": "fin-arbre",
      "file": "endings/fin-arbre.md",
      "when": {
        "all": [
          {
            "groupLocked": "cadets"
          },
          {
            "not": {
              "secret": "lettres-edda"
            }
          }
        ]
      },
      "priority": 1
    },
    {
      "id": "fin-edda",
      "file": "endings/fin-edda.md",
      "when": {
        "all": [
          {
            "groupLocked": "cadets"
          },
          {
            "secret": "lettres-edda"
          }
        ]
      },
      "priority": 2
    }
  ],
  "demo": {
    "documents": [
      "intro",
      "lettre-ancel",
      "acte-mariage",
      "photo-couple",
      "carte-postale",
      "photo-bac",
      "registre-val-dormant"
    ],
    "slots": ["s-ancel", "s-ida", "s-tomas"],
    "end": "registre-val-dormant"
  }
}
